category,text
sci-tech,"Companies Approve New High-Capacity Disc Format (Reuters) Reuters - A group of consumer electronics\makers said on Wednesday they approved the format for a new\generation of discs that can store five times the data of DVDs\at the same cost -- enough to put a full season of ""The\Sopranos"" on one disc."
sci-tech,Missing June Deals Slow to Return for Software Cos. (Reuters) Reuters - The mystery of what went wrong for the\software industry in late June when sales stalled at more than\20 brand-name companies is not even close to being solved\although the third quarter is nearly halfway over.
sci-tech,Hacker Cracks Apple's Streaming Technology (AP) AP - The Norwegian hacker famed for developing DVD encryption-cracking software has apparently struck again  #151; this time breaking the locks on Apple Computer Inc.'s wireless music streaming technology.
sci-tech,European Download Services Go Mobile (Reuters) Reuters - The ability to download complete\tracks directly over cell-phone networks to mobile phones is\becoming a reality in Europe.
sci-tech,"Open Source Apps Developer SugarCRM Releases Sugar.Sales 1.1 (TechWeb) TechWeb - News - August 13, 2004"
sci-tech,"Oracle Sales Data Seen Being Released (Reuters) Reuters - Oracle Corp. sales documents\detailing highly confidential information, such as which\companies receive discounts on Oracle's business software\products and the size of the discounts, are likely to be made\public, a federal judge said on Friday."
sci-tech,Sun's Looking Glass Provides 3D View (PC World) PC World - Developers get early code for new operating system 'skin' still being crafted.
sci-tech,"Apple to open second Japanese retail store this month (MacCentral) MacCentral - Apple Computer Inc. will open its second Japanese retail store later this month in the western Japanese city of Osaka, it said Thursday."
sci-tech,Charley's Force Took Experts by Surprise (AP) AP - Hurricane Charley's 145-mph force took forecasters by surprise and showed just how shaky a science it still is to predict a storm's intensity  #151; even with all the latest satellite and radar technology.
sci-tech,"Science, Politics Collide in Election Year (AP) AP - With more than 4,000 scientists, including 48 Nobel Prize winners, having signed a statement opposing the Bush administration's use of scientific advice, this election year is seeing a new development in the uneasy relationship between science and politics."
sci-tech,"Building Dedicated to Columbia Astronauts (AP) AP - A former dormitory converted to classrooms at the Pensacola Naval Air Station was dedicated Friday to two Columbia astronauts who were among the seven who died in the shuttle disaster Feb. 1, 2003."
sci-tech,"Russian Cargo Craft Docks at Space Station (AP) AP - A Russian cargo ship docked with the international space station Saturday, bringing food, water, fuel and other items to the two-man Russian-American crew, a space official said."
sci-tech,"Bangkok's Canals Losing to Urban Sprawl (AP) AP - Along the banks of the canal, women in rowboats grill fish and sell fresh bananas. Families eat on floating pavilions, rocked gently by waves from passing boats."
sci-tech,"T. Rex Had Teen Growth Spurt, Scientists Say (Reuters) Reuters - Tyrannosaurus Rex grew incredibly fast\during a teenaged growth spurt that saw the dinosaur expand its\bulk by six times, but the fearsome beasts ""lived fast and died\young,"" researchers said on Wednesday."
sci-tech,"Gene Blocker Turns Monkeys Into Workaholics - Study (Reuters) Reuters - Procrastinating monkeys were turned\into workaholics using a gene treatment to block a key brain\compound, U.S. researchers reported on Wednesday."
sci-tech,Dolphins Too Have Born Socialites (Reuters) Reuters - Some people are born to be the life and\soul of the party -- and so it seems are some dolphins.
sci-tech,"What's in a Name? Well, Matt Is Sexier Than Paul (Reuters) Reuters - As Shakespeare said, a rose by any other\name would smell as sweet. Right?"
sci-tech,"UK Scientists Allowed to Clone Human Embryos (Reuters) Reuters - British scientists said on Wednesday\they had received permission to clone human embryos for medical\research, in what they believe to be the first such license to\be granted in Europe."
sci-tech,"Russian Alien Spaceship Claims Raise Eyebrows, Skepticism (SPACE.com) SPACE.com - An expedition of Russian researchers claims to have found evidence that an \  alien spaceship had something to do with a huge explosion over Siberia in 1908. \  Experts in asteroids and comets have long said the massive blast was caused \  by a space rock."
sci-tech,"Comets, Asteroids and Planets around a Nearby Star (SPACE.com) SPACE.com - A nearby star thought to harbor comets and asteroids now appears to be home to planets, too. The presumed worlds are smaller than Jupiter and could be as tiny as Pluto, new observations suggest."
sci-tech,Perseid Meteor Shower Peaks Overnight (SPACE.com) SPACE.com - A fine display of shooting stars is underway and peaks overnight Wednesday into early Thursday morning. Astronomers expect the 2004 Perseid meteor shower to be one of the best versions of the annual event in several years.
sci-tech,"Redesigning Rockets: NASA Space Propulsion Finds a New Home (SPACE.com) SPACE.com - While the exploration of the Moon and other planets in our solar system is nbsp;exciting, the first task for astronauts and robots alike is to actually nbsp;get to those destinations."
sci-tech,"Studies Find Rats Can Get Hooked on Drugs (AP) AP - Rats can become drug addicts. That's important to know, scientists say, and has taken a long time to prove. Now two studies by French and British researchers show the animals exhibit the same compulsive drive for cocaine as people do once they're truly hooked."
sci-tech,"NASA Chief: 'Let's Go Save the Hubble' (SPACE.com) SPACE.com - Amid uncertainty over the fate of the Hubble Space Telescope and with a key instrument not working, NASA Administrator Sean O'Keefe gave the go-ahead Monday for planning a robotic servicing mission."
sci-tech,"Armadillo Aerospaces X Prize Prototype Crashes (SPACE.com) SPACE.com - Armadillo Aerospace of Mesquite, Texas has reported a \crash last weekend of their prototype X Prize rocket."
sci-tech,Prairie Dog Won't Be on Endangered List (AP) AP - The black-tailed prairie dog has been dropped from a list of candidates for the federal endangered species list because scientists have concluded the rodents are no longer threatened.
sci-tech,Hubble Trouble: One of Four Instruments Stops Working (SPACE.com) SPACE.com - One of the four astronomical instruments on the Hubble Space Telescope shut down earlier this week and engineers are trying to pin down the problem. The other three instruments continue to operate normally.
sci-tech,"Invasive Purple Weed May Meet Its Match (AP) AP - They burned it, mowed it, sprayed it and flooded it. But nothing killed the purple loosestrife weed, which has become a regional plague, until officials at the Parker River National Wildlife Refuge set a European beetle loose on it."
sci-tech,New NASA Supercomputer to Aid Theorists and Shuttle Engineers (SPACE.com) SPACE.com - NASA researchers have teamed up with a pair of Silicon Valley firms to build \  a supercomputer that ranks alongside the world's largest Linux-based systems.
sci-tech,"Ants Form Supercolony Spanning 60 Miles (AP) AP - Normally clannish and agressive Argentine ants have become so laid back since arriving in Australia decades ago that they no longer fight neighboring nests and have formed a supercolony here that spans 60 miles, scientists say."
sci-tech,"Viewer's Guide: Perseid Meteor Shower Peaks Aug. 11-12 (SPACE.com) SPACE.com - Every August, when many \  people are vacationing in the country where skies are dark, the best-known meteor \  shower makes its appearance. The annual Perseid meteor shower, as it is called, \  promised to put on an above average display this year."
sci-tech,"Rescuers Free Beached Whale in Brazil (AP) AP - Rescuers succeeded in freeing a minke whale that washed up on a beach in southeastern Brazil, the fire department said Thursday."
sci-tech,Red-Footed Falcon Sighted in Mass. (AP) AP - A red-footed falcon spotted for the first time in North America is enticing birdwatchers to Martha's Vineyard.
sci-tech,"Weak Version of Most Powerful Explosions Found (SPACE.com) SPACE.com - Gamma-ray bursts are the most powerful events in the universe, temporary outshining several galaxies and likely signaling the birth of a black hole."
sci-tech,Simultaneous Tropical Storms a Rarity (AP) AP - The prospect that a tropical storm and a hurricane  #151; or possibly two hurricanes  #151; could strike Florida on the same day is something meteorologists say they have never seen.
sci-tech,"NASA's Genesis Spacecraft Adjusts Course (AP) AP - NASA's Genesis spacecraft successfully adjusted its course this week as it heads back toward Earth with a sample of solar wind particles, the space agency said Wednesday."
sci-tech,"Earth is Rare, New Study Suggests (SPACE.com) SPACE.com - Flip a coin. Heads, Earth is a common sort of planet. Tails, and ours is as unusual as a coin landing on edge. That's about the state of knowledge for scientists who ponder the question of our planet's rarity."
sci-tech,"Scientists Probe Pacific for Dead Zone (AP) AP - His hand on a toggle switch and his eyes on a computer screen, Oregon State University graduate student Anthony Kirincich uses an array of scientific instruments to probe the vibrant waters of the Pacific. He is searching for the absence of life."
sci-tech,"Life on Mars Likely, Scientist Claims (SPACE.com) SPACE.com - DENVER, COLORADO -- Those twin robots hard at work on Mars have transmitted teasing views that reinforce the prospect that microbial life may exist on the red planet."
sci-tech,"India Rethinks Plan to Send Man to Moon (AP) AP - India is rethinking its plan to send a man to the moon by 2015, as the mission would cost a lot of money and yield very little in return, the national space agency said Thursday."
sci-tech,"Natural Sunblock: Sun Dims in Strange Ways (SPACE.com) SPACE.com - When Venus crossed the Sun June 8, showing up as a clear black dot to the delight of millions of skywatchers around the world, astronomers noted something less obvious: The amount of sunlight reaching Earth dipped by 0.1 percent for a few hours."
sci-tech,"Website Lets Users Scout the Red Planet from Home (SPACE.com) SPACE.com - For those who want to explore Mars but cant wait for a spacecraft to take them there, NASA scientists have reformulated a website that lets the general public search data and images from previous missions."
sci-tech,"Appeal Rejected in Trout Restoration Plan (AP) AP - The U.S. Forest Service on Wednesday rejected environmentalists' appeal of a plan to poison a stream south of Lake Tahoe to aid what wildlife officials call ""the rarest trout in America."""
sci-tech,Explore the Many Colors of Stars (SPACE.com) SPACE.com - One of the pleasures of \  stargazing is noticing and enjoying the various colors that stars display in \  dark skies. These hues offer direct visual evidence of how stellar temperatures \  vary.
sci-tech,"Britain Grants Human Cloning License (AP) AP - Britain granted its first license for human cloning Wednesday, joining South Korea on the leading edge of stem cell research, which is restricted by the Bush administration and which many scientists believe may lead to new treatments for a range of diseases."
sci-tech,The Next Great Space Race: SpaceShipOne and Wild Fire to Go For the Gold (SPACE.com) SPACE.com - A piloted rocket ship race to claim a  #36;10 million Ansari X Prize purse for privately financed flight to the edge of space is heating up.
sci-tech,"Growth, Mortality of T. Rex Gets Clearer (AP) AP - Here's a dinosaur finding that parents can appreciate: The teenage Tyrannosaurus rex typically went through an explosive growth spurt, gaining nearly 5 pounds a day."
sci-tech,"Space Science Pioneer Van Allen Questions Human Spaceflight (SPACE.com) SPACE.com - A leading space scientist has called to question the validity of human spaceflight, suggesting that sending astronauts outward from Earth is outdated, too costly, and the science returned is trivial."
sci-tech,"China Begins Manned Space Flight Countdown (AP) AP - Chinese astronauts are in the final stages of preparing for a manned space mission that will orbit the globe 14 times before returning to Earth, a state-run newspaper reported Thursday."
sci-tech,Sunspot Grows to 20 Times Size of Earth (SPACE.com) SPACE.com - A sunspot group aimed squarely \  at Earth has grown to 20 times the size of our planet and has the potential \  to unleash a major solar storm.
sci-tech,"Japanese Lunar Probe Facing Delays (AP) AP - A lunar orbiter that Japan had planned to launch this year could face further delays, possibly until next year or later, because of a funding shortfall and problems developing the probe's information-gathering capabilities, Japan's space agency said Wednesday."
sci-tech,Pollutants From Asia Appear on East Coast (AP) AP - Scientists looking into air quality and climate change have found pollutants from as far as Asia over New England and the Atlantic.
sci-tech,"Vietnam's Citadel Vulnerable to Weather (AP) AP - Experts from Europe and Asia surveyed 1,400-year-old relics of an ancient citadel in Hanoi Tuesday and said they were concerned the priceless antiquities were at risk from exposure to the elements."
sci-tech,"U.S. Barred From Weakening Dolphin Rules (AP) AP - In a victory for environmentalists, a federal judge ruled Tuesday that the Bush administration cannot change the standards commercial fisheries must meet before the tuna they catch can carry the ""dolphin-safe"" label."
sci-tech,Canadian Robot a Candidate to Save Hubble (AP) AP - NASA said Tuesday it is moving ahead with plans to send a robot to the rescue of the aging Hubble Space Telescope.
sci-tech,"Cave Explorers Discover Pit in Croatia (AP) AP - Cave explorers discovered a pit inside a mountain range in central Croatia believed to have the world's deepest subterranean vertical drop, at nearly 1,700 feet, a scientific institute reported Monday."
sci-tech,Aquarium Reviews Death of Dolphin (AP) AP - The chief scientist at the National Aquarium in Baltimore has launched a review of the dolphin breeding program after the death of a 4-month-old dolphin.
sci-tech,Scientists Seek Better Way to Measure Rain (AP) AP - Meteorologists at North Carolina State University are working on a way to more accurately measure rainfall in small areas.
sci-tech,"Wash. State Team's Private Rocket Explodes (AP) AP - A team taking a low-budget stab at the  #36;10 million Ansari X Prize for private manned spaceflight suffered a setback Sunday, when their rocket malfunctioned and exploded after shooting less than 1,000 feet in the air."
sci-tech,"Nevada Ponders Superfund Status for Mine (AP) AP - Pressured by a ranking senator from Nevada and the Environmental Protection Agency, Gov. Kenny Guinn says he might reconsider his opposition to a federal Superfund cleanup declaration for a huge abandoned mine contaminated with toxic waste and uranium."
sci-tech,"Indictments Using DNA on Rise Nationally (AP) AP - Authorities once had no choice but to drop rape cases if they weren't able to catch a suspect before the statute of limitations expired. But prosecutors across the country increasingly are buying themselves time, keeping cold cases alive by indicting unidentified rapists using their DNA profiles."
sci-tech,"Southeast Coast Sees Fewer Turtle Nests (AP) AP - About half the usual number of loggerhead turtles have nested between North Carolina and Florida this season, and scientists have no explanation for the drop."
sci-tech,"Company Said to Be Ready to Clone Pets (AP) AP - A company that unveiled the world's first cloned cat nearly three years ago now says it is ready to start filling orders for cloned pets, a newspaper reported Thursday."
sci-tech,"Deep-Sea Vessel Puts Ocean Floor in Reach (AP) AP - A new deep-sea research vessel will be able to carry people to 99 percent of the ocean floor, diving deeper than the famed Alvin that pioneered the study of seafloor vents, plate tectonics and deep ocean creatures over the past 40 years."
sci-tech,"Chorus Frog Found Croaking in Virginia (AP) AP - The Southern chorus frog has been found in southeastern Virginia, far outside its previously known range. The animal had never before been reported north of Beaufort County, N.C., about 125 miles to the south."
sci-tech,"Expedition to Probe Gulf of Mexico (AP) AP - Scientists will use advanced technology never before deployed beneath the sea as they try to discover new creatures, behaviors and phenomena in a 10-day expedition to the Gulf of Mexico's deepest reaches."
sci-tech,"Feds Accused of Exaggerating Fire Impact (AP) AP - The Forest Service exaggerated the effect of wildfires on California spotted owls in justifying a planned increase in logging in the Sierra Nevada, according to a longtime agency expert who worked on the plan."
sci-tech,"New Method May Predict Quakes Weeks Ahead (AP) AP - Swedish geologists may have found a way to predict earthquakes weeks before they happen by monitoring the amount of metals like zinc and copper in subsoil water near earthquake sites, scientists said Wednesday."
sci-tech,Marine Expedition Finds New Species (AP) AP - Norwegian scientists who explored the deep waters of the Atlantic Ocean said Thursday their findings  #151; including what appear to be new species of fish and squid  #151; could be used to protect marine ecosystems worldwide.
sci-tech,"Annual Study Finds Rise in Beach Closures (AP) AP - The number of days that beaches closed or posted warnings because of pollution rose sharply in 2003 due to more rainfall, increased monitoring and tougher standards, an environmental group said on Thursday."
sci-tech,Pacific May Be Seeing New El Nino (AP) AP - Warming water temperatures in the central equatorial Pacific last month may indicate the start of a new El Nino.
sci-tech,"Cassini Spacecraft Sees Saturn Lightning (AP) AP - The Cassini spacecraft's mission to Saturn has revealed a new radiation belt around the ringed planet and found that lightning in its atmosphere is occurring in different patterns than it did when NASA's Voyagers flew by in the early 1980s, scientists said."
sci-tech,"Poachers Putting Endangered Rhinos at Risk (AP) AP - Gangs of poachers in Congo have been slaughtering the world's minuscule population of northern white rhinos, reducing the population by about one-half in just more than a year, a key conservation organization said Friday."
sci-tech,"Experts Downplay Texas Shark Attacks (AP) AP - Three shark attacks off the Texas coast in the past two months are unusual but don't mean there are more sharks than normal along the beach or that they are getting bolder, marine biologists and other experts say."
sci-tech,"Study Says Birds Feed Other Birds' Young (AP) AP - It's a lesson many little humans could learn from baby birds: Sometimes, being nice to other youngsters pays off. Brown-headed cowbirds, like several other bird species, leave their eggs in the nests of other birds, who then feed and raise the cowbird chicks."
sci-tech,"Canadian Team Joins Rocket Launch Contest (AP) AP - The  #36;10 million competition to send a private manned rocket into space started looking more like a race Thursday, when a Canadian team announced plans to launch its rocket three days after an American group intends to begin qualifying for the Ansari X prize."
sci-tech,Universities to Build Largest Telescope (AP) AP - The University of Texas and Texas A amp;M University are planning to construct what they call the world's largest telescope with the help of a Houston businessman's  #36;1.25 million gift.
sci-tech,Mauritanian Capital Battles Locust Swarm (AP) AP - Residents burned tires and trash in the streets Thursday trying to drive off swarms of locusts descending on the region in what a U.N. agency called the worst sub-Saharan invasion in more than a decade.
sci-tech,"Customers of Telco Companies Face Privacy Breach A security advisory posted on Bugtraq demonstrates how hackers can compromise customers of T-mobile wireless and Verizon (landline) voicemail boxes. The advisory talks about the use of Caller-ID spoofing the customers number, allowing a bypass of the PIN code since the voicemail thinks that the customer is calling to check their own voicemail. According to Secure Science Corporation, there has been no response from the vendors. Comments have been posted that T-Mobile has optional PIN code protection off by default. Better turn it on. "
sci-tech,"Mozilla To Add Support For XForms, World Yawns It's ironic that Microsoft could help further cement its dominance in the browser market by joining its largest rival in an effort to support web standards.  nbsp;At the same time, that act would go a long way towards improving the web in general for developers and users alike."
sci-tech,"Junk faxes to be legalized as  quot;opt-out? quot; The Register ran a story on August 6th called 'Phone spam misery looms stateside.' It seems that there's legislative nastiness underway in Washington, DC to essentially gut the existing junk fax law, and replace it with a marketer's wet dream."
sci-tech,Biased Against Whom? Liberal bias versus right-wing conspiracy is a wonderful distraction. There is evidence enough on both sides. How can opposite claims be true? Confront a physicist with evidence supporting contradictory hypotheses and she will go looking for a more basic cause. Let's try that.
sci-tech,"The Visual World of Michel Gondry A month ago I was introduced to the works of Michel Gondry.  In short, I was amazed and tantalized by his short films and music videos.  Even if you haven't heard of him, you've probably seen his many works in Gap commercials, various music videos, and the recent movie Eternal Sunshine of the Spotless Mind.    Many of his works explode with visual elements that, when taken alone, are simple and mundane.  However, under his masterful guidance, these elements come together to form a highly mesmerizing visual experience.  He never ceases to push visual technologies and challenge our ideas about the visual medium."
sci-tech,"The Austral-Asian Strike Fighter The Australian Defence Force must defend and project across an air-sea gap. This requires long range autonomous strike weaponry. The Joint Strike Fighter does not solve this issue and detrimentally places added pressure on Australia's limited force of aerial refuelling assets. The world's defence manufacturers are not creating strike platforms that solve Australian needs. For this reason, Australia needs to look to other nations with similar defence needs. In this case, Japan, South Korea and Taiwan all face defending an air-sea gap. Australia should enter a partnership with these nations to create a strike fighter that satisfies the strategic needs of defending an air-sea gap. The benefits of such a partnership will be many."
sci-tech,"Insecurity: (Or Why Americans Aren't Feeling The Recovery) The New Republic's website is currently carrying an interesting piece which tries to explain the anomaly that although the US economy is growing, a lot of its citizens are still feeling worse off. The article explains the results of a 40 year panel study which has shown that although mean incomes have increased, income variability has increased massively, causing many Americans to feel less well off, despite the growing economy.      "
sci-tech,"The Great K5 Limerick Contest Queue submissions being scarce, I suggest we all submit limericks for consideration.  Mod up your favorites.    I'm no poet, so I'll submit a favorite of my childhood:    There was a young woman named Bright,  Who traveled much faster than light    She set out one day  In a relative way    And returned on the previous night.    I'm afraid I don't remember the author."
sci-tech,"RuntimeProperties... Reflection from System Properties \\Java developers often load system properties to customize the runtime behavior\of their applications.\\For example a develoepr could define a 'max_connections' system property to\define the maximum number of TCP connections that their application server can\support.  While nice, this prevents all other applications from using this\variable name.\\The first reaction to this would be to namespace your variable names.  Instead\of using max_connections you would now use\'my.application.Server.MAX_CONNECTIONS' as your property name.  This works of\course but now you have to load this property on startup.\\public static int MAX_CONNECTIONS = Integer.parseInt( System.getProperty(\""my.application.Se ...\\"
sci-tech,Thank You IBM! \\I just wanted to say thanks to IBM for Open Sourcing  Cloudscape .\\You guys really have your act together.  Keep up the good work!\\
sci-tech,"LinuxWorld, IDs, and Privacy \\Today Jonathan Moore  and I headed over to LinuxWorld after lunch to see what\kind of cool hardware and Linux hacks they had on the expo floor.\\Only \$15 to get in the door so I figure why not.\\I'm a bit of a privacy freak.  When you're trading some security for liberty\there are situations where it *might* be worth it.  In situations of extreme\violence having the police by your side might be a good idea.  \\I think we can all agree that trading liberty for *nothing* isn't worth it.\This country was *founded* on liberty after the British were abusing their\colonial powers.  Every true American should cherish their liberty and think\long and hard about just turning them over for no reason.\ ...\\"
