category,text
sci-tech,My Blog as a Time Machine \\I'm starting to realize that my blog is a bit of a time machine.  For example I\can create a blog entry to warn myself about something that WILL happen in the\future.  \\My current NTP  blog entry is a good example.  I wrote this for myself as\much as for the people who read my blog (or find me via Google).\\I know for sure that NTP on Debian is going to bite me sometime in the future\and I'm going to forget WHY.  Then I'm going to (of course) go to Google or my\aggregator and search for NTP and then find my blog post.  \\I've done this about a dozen times now and its saved me a TON of time!\\
sci-tech,NTP in Debian \\The Network Time Daemon (NTP  Daemon) implementation within Debian leaves a\lot to be desired.\\First off they don't include it with a working config.  You have to create your\own /etc/ntpd.conf.  To make matters worse the configuration doesn't accept DNS\names so you have to manually enter IPs.  Fun.  I can understand that they might\not want to provide ONE configuration and overwhelm one or two NTP servers but\they can provide a dynamic config that balances load among all available\servers.  There is of course the public serves list  but you have to Google\for it.\\All you really need to do here is enter a list of servers:\\server time.nist.gov\\server 192.43.244.18\
sci-tech,"Pretty Log4J \\I've been a big fan of Log4J  for a while now but haven't migrated any code\over for one central reason.  The following line of code:\\    final static Logger logger = Logger.getLogger( ""some.name"" );\\... is amazingly ugly and difficult to work with.\\Most people use Log4J with a logger based on the classname:\\So we would probably see:\\    static Logger logger = Logger.getLogger( ""org.apache.commons.feedparser.locate.FeedLocator"" );\\Which is amazingly verbose.  A lot of developers shorten this to:\\    static Logger logger = Logger.getLogger( FeedLocator.class );\\But this still leaves us with cut and paste errors.\\What if we could just reduce it to:\\    static Logger logger = Logger.g ...\\"
sci-tech,"Saudis: Bin Laden associate surrenders \\""(CNN) -- A longtime associate of al Qaeda leader Osama bin Laden surrendered to\Saudi Arabian officials Tuesday, a Saudi Interior Ministry official said.""\\""But it is unclear what role, if any, Khaled al-Harbi may have had in any terror\attacks because no public charges have been filed against him.""\\""The Saudi government -- in a statement released by its embassy in Washington --\called al-Harbi's surrender ""the latest direct result"" of its limited, one-month\offer of leniency to terror suspects.""\\This is great!  I hope this really starts to pay off.  Creative solutions to\terrorism that don't involve violence.  \\How refreshing! \\Are you paying attention Bush administration?\\"
sci-tech,Mozilla Exceptions (mexception) \\For some reason I never released this code.\\I developed it while working on NewsMonster and just forgot I think\\It's an extension for Mozilla that allows you to see all runtime exceptions\(with full stack traces) that are unhandled by Mozilla. \\Just install it and if your code generates an unhandled exception it will show\up in the logs and on the console.\\Very handy for doing any hardcore Mozilla development.\\
sci-tech,"Ron Regan Jr is My Kinda Guy \\""Now that the country is awash in Reagan nostalgia, some observers are predicting\that you will enter politics. Would you like to be president of the United\States?""\\""I would be unelectable. I'm an atheist. As we all know, that is something\people won't accept.""\\""What would you do if Senator Kerry asked you to be his vice president?""\\""I would question his sanity.""\\""Do you ever go to church?""\\""No. I visit my wife's sangha.""\\""So you sometimes practice Buddhism?""\\""I don't claim anything. But my sympathies would be in that direction. I admire\the fact that the central core of Buddhist teaching involves mindfulness and\loving kindness and compassion.""\\So lets get this straight.  He's an a ...\\"
sci-tech,"Al Qaeda member surrenders \\""RIYADH, Saudi Arabia (CNN) -- One of Saudi Arabia's most wanted militants has\turned himself into the authorities, the first senior suspect to surrender under\a one-month government amnesty announced last week.""\\""Othman Al-Omari, number 19 on Saudi Arabia's most wanted list of 26, accepted\King Fahd's offer of amnesty, which was made last week, according to Saudi\sources Monday.""\\""Al-Omari, who turned himself in on Sunday night, was a business partner of\Shaban Al Shihri -- the first al Qaeda member to accept the offer when he turned\himself in Friday.""\\When I first saw this I was really upset.  I thought that it would certainly\lead to more violence if they just let terrorists off the ...\\"
sci-tech,"Mission Accomplished! \\""BAGHDAD, Iraq (CNN) -- Members of Iraq's interim government took an oath of\office Monday just hours after the United States returned the nation's\sovereignty, two days ahead of schedule.""\\""Led by Iraq's interim Prime Minister Ayad Allawi, each member of the new\government placed a hand on the Koran and promised to serve with sincerity and\impartiality. Iraqi flags lined the wall behind them.""\\Iraq!  Now with 100 less Coalition Provisional Authority!  Act now and get a\free Weapon of Mass Destruction (offer only available in Syria, Jordan, Saudi\Arabia, Pakistan, Syria and Iran).\\Also check out our new Puppet Government!  Keeps the kids occupied for hours!\\"
